{
  "formatVersion": 1,
  "status": "pre-m0-inventory-draft",
  "sourcePlanSha256": "4ace5e349bedd45b16cd87182aed3306d33fae92b034ed01ddb93bc733c5f62d",
  "scope": [
    "8",
    "9",
    "10",
    "11",
    "12",
    "13",
    "14"
  ],
  "blocks": [
    {
      "id": "INV-8-14-001",
      "lineStart": 2452,
      "lineEnd": 2454,
      "sourceAnchor": "\u00a78.1 generated-corpus contract",
      "synopsis": "Define the generated CLDR corpus as expanded cardinal, ordinal, and cardinal-range conformance data rather than display examples.",
      "disposition": "initial-registration",
      "registrationBefore": [
        "M1"
      ],
      "owner": "M1",
      "parityClass": "portable",
      "anticipatedAtomicRecords": 4,
      "reason": "M1 generates the data and M3a must seed the executable Java oracle before M2."
    },
    {
      "id": "INV-8-14-002",
      "lineStart": 2456,
      "lineEnd": 2462,
      "sourceAnchor": "\u00a78.1 generated-ID examples",
      "synopsis": "Illustrate generated case-ID spelling.",
      "disposition": "nonnormative",
      "registrationBefore": [],
      "owner": "none",
      "parityClass": "informational-nonportable",
      "anticipatedAtomicRecords": 0,
      "reason": "The fenced values are examples; the following paragraph carries the ID rules."
    },
    {
      "id": "INV-8-14-003",
      "lineStart": 2464,
      "lineEnd": 2468,
      "sourceAnchor": "\u00a78.1 stable generated IDs",
      "synopsis": "Require coordinate-derived sample and range IDs, full-hash locking, collision rejection, and requirement links.",
      "disposition": "initial-registration",
      "registrationBefore": [
        "M1"
      ],
      "owner": "M1",
      "parityClass": "portable",
      "anticipatedAtomicRecords": 6,
      "reason": "These rules define M3a corpus identity and traceability."
    },
    {
      "id": "INV-8-14-004",
      "lineStart": 2470,
      "lineEnd": 2471,
      "sourceAnchor": "\u00a78.1 derived totals",
      "synopsis": "Derive acceptance totals from the corpus and forbid a hard-coded historical display-example count.",
      "disposition": "initial-registration",
      "registrationBefore": [
        "M1"
      ],
      "owner": "M1",
      "parityClass": "process-only",
      "anticipatedAtomicRecords": 2,
      "reason": "M3a generation and gates need this count policy."
    },
    {
      "id": "INV-8-14-005",
      "lineStart": 2475,
      "lineEnd": 2492,
      "sourceAnchor": "\u00a78.2 behavioral-vector schema example",
      "synopsis": "Establish the versioned behavioral-vector envelope and its stable ID, requirement-link, fixture, operation, input, and expected fields.",
      "disposition": "initial-registration",
      "registrationBefore": [
        "M0"
      ],
      "owner": "M0",
      "parityClass": "process-only",
      "anticipatedAtomicRecords": 10,
      "reason": "M0 freezes the schema and M3a populates it."
    },
    {
      "id": "INV-8-14-006",
      "lineStart": 2494,
      "lineEnd": 2496,
      "sourceAnchor": "\u00a78.2 vector payload list item 1",
      "synopsis": "Allow vectors to supply one or more named raw strings-file fixtures with locale tags.",
      "disposition": "initial-registration",
      "registrationBefore": [
        "M0"
      ],
      "owner": "M0",
      "parityClass": "process-only",
      "anticipatedAtomicRecords": 3,
      "reason": "Fixture representation is needed by the initial behavioral corpus."
    },
    {
      "id": "INV-8-14-007",
      "lineStart": 2497,
      "lineEnd": 2497,
      "sourceAnchor": "\u00a78.2 vector payload list item 2",
      "synopsis": "Allow tiebreakers, fallback locale, callback fixture IDs, and registered data modules.",
      "disposition": "initial-registration",
      "registrationBefore": [
        "M0"
      ],
      "owner": "M0",
      "parityClass": "process-only",
      "anticipatedAtomicRecords": 4,
      "reason": "These are independent initial corpus inputs."
    },
    {
      "id": "INV-8-14-008",
      "lineStart": 2498,
      "lineEnd": 2498,
      "sourceAnchor": "\u00a78.2 vector payload list item 3",
      "synopsis": "Allow lookup keys, locale or language ranges, typed placeholders, and per-call options.",
      "disposition": "initial-registration",
      "registrationBefore": [
        "M0"
      ],
      "owner": "M0",
      "parityClass": "process-only",
      "anticipatedAtomicRecords": 4,
      "reason": "These are independent cross-language operation inputs."
    },
    {
      "id": "INV-8-14-009",
      "lineStart": 2499,
      "lineEnd": 2499,
      "sourceAnchor": "\u00a78.2 vector payload list item 4",
      "synopsis": "Allow expected results, failure-handler inputs, warning sets, and thrown error or cause identity tokens.",
      "disposition": "initial-registration",
      "registrationBefore": [
        "M0"
      ],
      "owner": "M0",
      "parityClass": "process-only",
      "anticipatedAtomicRecords": 4,
      "reason": "These independent outcomes must be expressible before M3a evidence."
    },
    {
      "id": "INV-8-14-010",
      "lineStart": 2501,
      "lineEnd": 2501,
      "sourceAnchor": "\u00a78.2 public wire shapes",
      "synopsis": "Use the exact public tagged-record wire shapes for decimal, plural-operand, and language-form values.",
      "disposition": "initial-registration",
      "registrationBefore": [
        "M0"
      ],
      "owner": "M0",
      "parityClass": "portable",
      "anticipatedAtomicRecords": 3,
      "reason": "M0 fixes the portable wire shapes before M3a authors executable vectors."
    },
    {
      "id": "INV-8-14-011",
      "lineStart": 2504,
      "lineEnd": 2510,
      "sourceAnchor": "\u00a78.2 semantic ID partitions and activation",
      "synopsis": "Give IDs proposition identity, partition portable, implementation, and informational cases, require exact set reporting, and derive activation from the registry.",
      "disposition": "initial-registration",
      "registrationBefore": [
        "M0"
      ],
      "owner": "M0",
      "parityClass": "process-only",
      "anticipatedAtomicRecords": 12,
      "reason": "The schema and reporting rules must exist before M3a cases and milestone activation."
    },
    {
      "id": "INV-8-14-012",
      "lineStart": 2512,
      "lineEnd": 2512,
      "sourceAnchor": "\u00a78.2 development xfail metadata",
      "synopsis": "Every development xfail records severity, owner, reason, and expiry.",
      "disposition": "initial-registration",
      "registrationBefore": [
        "M0"
      ],
      "owner": "M3b",
      "parityClass": "process-only",
      "anticipatedAtomicRecords": 4,
      "reason": "The vector schema must carry complete xfail metadata before the first corpus work begins."
    },
    {
      "id": "INV-8-14-013",
      "lineStart": 2520,
      "lineEnd": 2520,
      "sourceAnchor": "\u00a78.3 fixture-set minimum",
      "synopsis": "Require the first behavioral-vector version to include at least the listed high-risk families.",
      "disposition": "initial-registration",
      "registrationBefore": [
        "M3a"
      ],
      "owner": "M3b",
      "parityClass": "process-only",
      "anticipatedAtomicRecords": 1,
      "reason": "M3a must establish the corpus contract even though M3b completes most families."
    },
    {
      "id": "INV-8-14-014",
      "lineStart": 2522,
      "lineEnd": 2523,
      "sourceAnchor": "\u00a78.3 fixture 01 supplier-locale evaluation",
      "synopsis": "Cover fallback entries evaluated under the supplying locale across the named language set.",
      "disposition": "deferred",
      "registrationBefore": [
        "M3b"
      ],
      "owner": "M3b",
      "parityClass": "portable",
      "anticipatedAtomicRecords": 8,
      "reason": "This is part of full core-semantic corpus growth after the M3a seed."
    },
    {
      "id": "INV-8-14-015",
      "lineStart": 2524,
      "lineEnd": 2524,
      "sourceAnchor": "\u00a78.3 fixture 02 Portuguese separation",
      "synopsis": "Cover pt versus pt-PT at 0, 0.0, and 1.5 to prevent same-language flattening.",
      "disposition": "initial-registration",
      "registrationBefore": [
        "M3a"
      ],
      "owner": "M3a",
      "parityClass": "portable",
      "anticipatedAtomicRecords": 3,
      "reason": "Fallback distinctions are explicit M3a seed behavior."
    },
    {
      "id": "INV-8-14-016",
      "lineStart": 2525,
      "lineEnd": 2525,
      "sourceAnchor": "\u00a78.3 fixture 03 alternatives-only",
      "synopsis": "Cover alternatives-only children that both hit and miss.",
      "disposition": "deferred",
      "registrationBefore": [
        "M3b"
      ],
      "owner": "M3b",
      "parityClass": "portable",
      "anticipatedAtomicRecords": 2,
      "reason": "This belongs to completed behavioral coverage rather than the minimal M3a seed."
    },
    {
      "id": "INV-8-14-017",
      "lineStart": 2526,
      "lineEnd": 2527,
      "sourceAnchor": "\u00a78.3 fixture 04 expressions",
      "synopsis": "Cover precedence, short-circuiting, invalid chained comparisons, raw-string non-equality, and missing, null, and cross-axis operands.",
      "disposition": "deferred",
      "registrationBefore": [
        "M3b",
        "M6"
      ],
      "owner": "M6",
      "parityClass": "portable",
      "anticipatedAtomicRecords": 7,
      "reason": "M3b is the corpus-registration deadline; M6 remains the owning evidence/exit milestone for expression behavior."
    },
    {
      "id": "INV-8-14-018",
      "lineStart": 2528,
      "lineEnd": 2529,
      "sourceAnchor": "\u00a78.3 fixture 05 generated placeholders",
      "synopsis": "Cover generated branch inheritance, replacement modes, raw-input selector scope, late binding, cycles, and expansion limits.",
      "disposition": "initial-registration",
      "registrationBefore": [
        "M3a"
      ],
      "owner": "M3b",
      "parityClass": "portable",